"https://www.imdb.com/title/tt11679978/reviews/?ref_=adv_li_tt","1"," Worst Movie ","There is no zero star, hence 1, worst movie to watch for 2 hours. Please go and watch a dubbed hit movie than wasting time on this one."
"https://www.imdb.com/title/tt11679978/reviews/?ref_=adv_li_tt","1"," Worst direction, Worst ScreenPlay and worst acting ","I do not know how this movie got 8.2,,, The lawyer goes to work on old scooter however will have a big bungalow and he speaks on Status...******************************"
"https://www.imdb.com/title/tt11679978/reviews/?ref_=adv_li_tt","1"," Don't watch worst movie ","Worst story, worst acting, worst direction, worst screen play, worst movie I saw in my life .. Don't watch don't waste your time.I can't understand one thing why rating should be 8 above??????"
"https://www.imdb.com/title/tt11679978/reviews/?ref_=adv_li_tt","1"," Anyone can be a actor....you just need money ","This movie proves that anyone can be a actor if he/she has money."
"https://www.imdb.com/title/tt11679978/reviews/?ref_=adv_li_tt","1"," Worst movie ","This reviews I reckon made by movie team, worst third class movie.I watched bcz of rating.Such a waste of time."
"https://www.imdb.com/title/tt11681282/reviews/?ref_=adv_li_tt","8"," a classic nouvelle... ","About the 19th century psychiatry treatment of women in le hospitale salphetriere in paris, france. Its a well made jump back to the past, where womens destiny where the mens decision, a fathers decision, a brothers decision or a husbands decision, if you were apart from the common term of normality, they could put you in a house for madwomen with a blink of an eye.Acting is superb, though the story might feel a bit shallow and it-ified, where the caracter build is purely towards the main caracter, i feel far more shouldve been spent on the copatients and doctors, who many of them where real life caracters..staging of the sets are impecable, youe drawn into a miljoe of darkness and madness, the musical score that contains lots of deep cello tones do enhance the tragedy of them lost soles in the socalled human care business, thank god things have cchanged to the better, but still humanity has a giant leap to take to make psychiatric care and medicine perfect.Its a french edition of the typical dickensian british take on the mental ill a good take thinks the grumpy old man, but not perfect."
"https://www.imdb.com/title/tt11681282/reviews/?ref_=adv_li_tt","6"," Who's mad indeed? ","Quite a interesting storyline and powerful acting and beautiful movie. You can get a lot from this movie for sure, about super nature, right or wrong, history lesson, sympathy and angry."
"https://www.imdb.com/title/tt11681282/reviews/?ref_=adv_li_tt","8"," Great work from Laurent ","My dear Genevive, we are free...After Oxygen, Mlanie Laurent returns directing and starring in an Amazon original.As a director, Laurent did a great job showing the cruelty in the treatment of women in asylum back in the days. The "therapies" were nothing different from tortures. However, within the cruelty was the premise that added heart to the characters. I liked that the movie didn't scream feminism, but let the scenes play out so audiences could root for the women characters.Probably my only problem was the movie became pretty predictable near the end. I liked how the two main characters were tied to each other, but what became of it was quite clear and not surprising.Overall, a solid and well done movie. 7.5/10."
"https://www.imdb.com/title/tt11681282/reviews/?ref_=adv_li_tt","7"," Women's History Reimagined ","Ice water soakings, solitary confinement in dark cells, tranquilizers, and random body cavity inspections are just a sampling of the standard psychiatry treatments inflicted upon captive female patients in France 130 years ago. Free spirited Eugenie suffers debilitating visions that she cannot control or understand. She is only in need of some gentle guidance, understanding, and self-confidence. Instead, Eugenie is tricked by her parents and committed against her will to a cruel and misogynistic psychiatric ward. Abandoned by her relatives, Eugenie finds a different family among her unlucky ward sisters.Women's history is reimagined in a scorching yet sensitive way by Melanie Laurent who directs and stars in the film. Thankfully the film is made in France, and therefore uncensored and blunt. While the film lacks cohesion and a little spark, it is enlightening and energizing to witness multidimensional, realistic, and complicated female characters, and women behind as well as on the screen who are defined not by men but by themselves.World premiere seen at the Toronto international film festival."
"https://www.imdb.com/title/tt11681282/reviews/?ref_=adv_li_tt","6"," Logros parciales en una combinacin de elementos que no alcanza unaPartial achievements in a combination of elements that does not reach a good synthesis ","SummaryMlanie Laurent's film addresses several issues, such as the disciplinary and patriarchal psychiatry of the time and its methods, a supposedly fantastic subplot and the tribulations of its proto-feminist protagonist, with uneven fortune in his development, in the combination of them and in the resulting message. Despite its great staging and its very good performances, it leaves the viewer with a sadness resulting from having witnessed a harsh story about helpless and violated women but that could have been better told, a sadness mix of empathy with them and frustration.Review:Eugnie (Lou de Lage) is a curious young woman with intellectual concerns (a fan of Victor Hugo), with a wealthy and conservative family that takes care to suppress these concerns and prevent her from channeling them. When the father learns that the girl refers to "speaking with spirits", he decides to commit her to the famous Hpital de la Salptrire, a psychiatric institution run by neurologist Jean-Martin Charcot, where he forges a bond with Genevive, the head of nurses (Mlanie Laurent ).Mlanie Laurent's film tackles several issues, with uneven success in its development, in their combination, and in the resulting message. In the first place, it illustrates the cruel "therapeutic" methods of psychiatry at the time, in an institution where in those years (the 80s of the 19th century) Freud himself practiced. It is clear in the film the role of the psychiatric institution and its methods as a device for patriarchal disciplining of "wayward" women (also reduced to the role of guinea pigs), standing as a successor to the witch hunt, now become "hysterical ", According to their definitions. A change from a religious paradigm to a strictly positivist one, both equally totalizing.Secondly, there is the question of Eugnie's connection with the spirits of the dead, does it constitute a delusion of the protagonist or does she indeed possess that gift of hers? This aspect makes some noise and partially weakens the message of the film since at some point it "contaminates" and "justifies" for the gaze of the time the reasons why the protagonist is hospitalized. At the same time, however, the film makes some interesting notes on the relation of rationalistic positivism to the supernatural and religious and on the arrogance of positivism itself in general.Third, the dramatic lift, where the film describes how the protagonist goes from her affluent but unsatisfied family life to the tribulations of mental hospitalization and the ways in which she relates to her companions and her medical staff. She. It is here where Laurent tries to balance rawness with restraint, objectivity with emotion, but the result works by half, since she also fails to provide a too original look. It is in this scenario that the agreements between the patient and the nurse will be woven, where not only the nurse is the one who seeks her salvation. This is where the proto-feminist and sisterhood elements of the story also appear.The Mads Women (the viewer will already see the reason for the title) is a dark and melancholic film, with a great staging where the reconstruction of the period stands out and that has very good performances, but that leaves the viewer with a sadness Resulting from witnessing a harsh story about neglected and abused women that could have been better told, a sadness mixed with empathy with them and frustration."
"https://www.imdb.com/title/tt11681282/reviews/?ref_=adv_li_tt","5"," Interesting, but not really accurate ","Were people treated terribly in asylums? Yes indeed. Were women, who did not have the same rights as today, the frequent victims? Yep. However....This takes place in 1885, just after Victor Hugos death. At that time, spiritualism was all the rage in England. I guess you have to forget about that."
"https://www.imdb.com/title/tt11681282/reviews/?ref_=adv_li_tt","8"," Delightful Movie ","This is really a delightful movie. A beautiful and dramatic story . A touching tale of suffering , friendship , salvation and redemption in a time of barbaric psychiatry methods ."
"https://www.imdb.com/title/tt11681282/reviews/?ref_=adv_li_tt","9"," art e belle ","Beside the fact that is a view on how hard we are evolved, and just 150 ago we treated humans as us just based on social idiotic principles, the script is an art evoque and with great acting!"
"https://www.imdb.com/title/tt11681282/reviews/?ref_=adv_li_tt","8"," safety pin! what a good story it will surprise you ","I was totally unaware of this film because I did not see any publicity but I was encouraged to see it without even knowing what it was about. What can I tell you, this movie was awesome from start to finish. The story is brilliant, costumes and performances impeccable, the music is beautiful and I am fascinated. I Love French cinema! In fact it is the first French film produced by Amazon."
"https://www.imdb.com/title/tt11681282/reviews/?ref_=adv_li_tt","7"," well made , but... ","Could have been better.The production, set ,acting are all first class.I was hoping for something special to happen.Maybe Allan Kardec to show up (The spirits Book author) , or the fathers concerned to come to the rescue.To much left unresolved , as others have said."
"https://www.imdb.com/title/tt11681282/reviews/?ref_=adv_li_tt","8"," It is a very good and beautiful movie ","It has all ingredients to be a great film. Superb acting, good script, amazing cinematography, music and art direction and a great job from Melanie in the directing. A nice and touching story very well made and told that makes you feel a variety of feelings. It is a jewel that you must watch."
"https://www.imdb.com/title/tt11681282/reviews/?ref_=adv_li_tt","1"," Great Story ","The film was well directed and acted. You could feel the tension, pain and despair of the women. Sadly a lot of this was probably normal. It is a period piece and I was impressed with the thoroughness of the film. I would have liked to know what happened after to everyone but that is what makes a good story."
"https://www.imdb.com/title/tt11681282/reviews/?ref_=adv_li_tt","10"," Beautiful story told in a beautiful way ","So I watched a French movie (with French audio and English subs to try and keep it authentic as much as possible since I do not speak the language) for the first time, ever). And I am left stunned by it. The acting is top-notch and on point always. Since I have gotten to experience kinda similar treatment in hospitals (MS patient living in a "third world" country) the emotions were relayed rather easily. I also really liked the underlying karma story at the end. All in all, a roller coaster of emotions and I do hope souls that have passed on are indeed watching over us (got a few myself). A must watch in my book and I thank the CNN article that I glanced over this morning mentioning it. Totally worth the time spent watching it. One of those unexpected and hard to find rare gems."
"https://www.imdb.com/title/tt11681282/reviews/?ref_=adv_li_tt","10"," Breathtaking ","This film was breathtaking from start to finish. Brilliant story, incredible acting, beautifully haunting music score. It was intriguing, and mesmerizing. One of the better films I've seen recently."
"https://www.imdb.com/title/tt11681282/reviews/?ref_=adv_li_tt","7"," Liked it a lot, but too much left unresolved ","While appreciating how beautiful this production is and how talented the actors are, and after becoming entranced in the story, I felt let down at the end because too much was left without a resolution. What happened to the best friend patient? She was being raped while paralyzed by a doctor for God's sake and the act was interrupted by 2 other patient friends, but what happened to them? Was the doctor punished? Did she get better in the end? Also of the entire family the Grandmother understood the main character but she never appears again after a few scenes from the beginning.In addition, I felt more bonding should have been done between the two main characters....it didn't seem real that there was enough of an emotional bond between them to merit the head nurse losing her freedom."
"https://www.imdb.com/title/tt11681282/reviews/?ref_=adv_li_tt","10"," Beautiful movie ","One of the best movies I have ever seen, wonderful casting, all did a superb job of acting. These ladies deserve awards for their work. I recommend this film to everyone."
"https://www.imdb.com/title/tt11683592/reviews/?ref_=adv_li_tt","1"," Pointless! ","This is pretty much produced at the level of a community theater play. The plot is silly and fails to engage the viewer. It must have been made with a specific audience in mind, and to meet a targeted agenda, not for global appeal."
"https://www.imdb.com/title/tt11683592/reviews/?ref_=adv_li_tt","8"," Laugh aloud ","Great fun. I laughed so hard.. it's worth seeing. I know what Trump tried to do and this film just emphasized his flaws. We see airport security and the careless attitude of the US towards Hispanics. We see our country's history and indifference. It's a film with good laughter moments to release all angry tension."
"https://www.imdb.com/title/tt11686490/reviews/?ref_=adv_li_tt","6"," up to a point ","Ben and Tina are a young couple exploring abandoned places and putting the footage on the internet. They are in southwest France looking for a place under a man-made lake. Ben is disappointed to find it as a tourist spot. Tina is happy to have a vacation day until Ben finds local Pierre who is willing to guide them to a house under a remote part of the lake.This is actually interesting up to a point. I like the underwater discovery until it gets too chaotic. The filming becomes too confused when they are being chased by the dead. It's impossible to be scared when you don't know what you're seeing. The movie needs to make a flip. When the dead bodies come to life, they should be transported back in time to whenever the incident happened. In that way, the last act can become something more traditional."
"https://www.imdb.com/title/tt11686490/reviews/?ref_=adv_li_tt","8"," now and then... ","There shows up some really spooooky,entangling, nightmareish and suffocating horror movies that will carve out a cut in your totempeel of moviehighlights, and even thought i hate the found footage genre, this one hit me like a silky glow just as an understatement.Its made in the eu, with english language as main language, but dives into the depths of an artifiscial , damned lake of freakin france. The couple who loves, like me, to hunt for old desolated houses to explore, and even scubadive for it, because its exciting and may make some does on youtube. But things doest appear as they want it to, there fore send a drone first for a safety check, then have a look yourself.Its a typical horror story, short story and short playtime, but it is a marvelous production, anyhow its just special effect or its real, it works...im a pretty old grumpy man with a low level of physical breathing capacity, and holding my breath for 30 sek's is near drowning internally, so you will have to be in good shape and good at o2 conservation, aka holding your breath because you will either you will or not have to draw your breath in the end, so if youre still alaive, then its a recommend. Intense and cleverly made..."
"https://www.imdb.com/title/tt11686490/reviews/?ref_=adv_li_tt","1"," Another worst horror film! Full of boring conversation, and annoying overuse scene! Avoid at all cost! ","This film start with two people doing video log, and both of them went into a house scene! As turnout, this film is about a couple(Tina, and Ben) need to survive in a underwater house with dark spirit in it! Entire film full of boring conversation, and annoying overuse scene! Such as, overuse of the walking scene, overuse of the searching scene, overuse of the staring scene, overuse of the arguing scene, overuse of the calling names scene, overuse of the blackout scene, overuse of the watching video scene, overuse of the driving scene, overuse of the swimming scene, overuse of the yelling scene, overuse of the jump scare scene, overuse of the breathing sound scene, overuse of the smoking scene, and overuse of the drinking scene! Make the film unwatchable! At the end, Tina, and Ben both die at the lake! Still have a post credit scene! Pierre, and two girls stare at the lake! That's it! Wasting time to watch!"
"https://www.imdb.com/title/tt11686490/reviews/?ref_=adv_li_tt","7"," Blumhouse ","I have been following Blumhouse Productions films since the day it was founded.This is the first time I've seen a movie they didn't make marketed under the Blumhouse Productions label.If I talk about the movie; An above average Blumhouse movie.Especially the underwater shots were exquisite.The cinematographer must be congratulated.Also, the song selection was great."
"https://www.imdb.com/title/tt11686490/reviews/?ref_=adv_li_tt","8"," Underwater Horror ","The Deep House: A haunted house but this one is submerged. Two youtube bloggers, James Jagger and Camille Rowe travel to South West France to explore and film an underwater village in a flooded valley but find that that the lake is now a popular tourist resort, with boating and swimming in different areas and in any case the houses are in ruins. A local man offers to bring them to an isolated arm of the reservoir where an intact submerged house may be examined. Most of the film takes place underwater, the settings being eerie before they even penetrate the villa even a fish suddenly appearing is threatening, a floating doll in a room is eerie as any ghost. Dark deeds have occurred in this home, a memory of evil lives on. The nature of the mystery is revealed as the divers discover artifacts and other clues. Some well portrayed scenes of horror with gruesomely imagined undead. The tension is well maintained as the couple struggle to survive and escape from their ordeal before their air runs out. A satisfyingly nail biting horror thriller. Co -Directed & Co-Written by Alexandre Bustillo and Julien Maury. 8/10."
"https://www.imdb.com/title/tt11686490/reviews/?ref_=adv_li_tt","7"," I ENJOYED IT. ","I enjoyed it. The ambiance, and some of the scenes, are suffocating/stressfull as hell. It's a good movie to watch alone with the sound UP!!!...or not. :/"
"https://www.imdb.com/title/tt11686490/reviews/?ref_=adv_li_tt","5"," 4.5 Stars Rounded Up To Five. Here's Why... ","OK. As most reviewers have indicated, the concept is somewhat unique but the overall story is lacking character depth and better explanation.The film quality was not bad but the dialogue didn't add much direction or give the viewer reasons to invest in the characters. There were a few creepy moments but nothing to rave about and there was, in my opinion, a lack luster ending.Simply put, it wasn't awful but it has a long way to go before it can be compared to this directorial duo's brilliance displayed in their prior film "Inside"."
"https://www.imdb.com/title/tt11686490/reviews/?ref_=adv_li_tt","6"," A good effort (and a nice ending) ","The Deep House is an average film most of the time.Only 20 minutes were spent on setting things up, and most of the film's middle part was interesting underwater exploration with a couple of jumpscares.It did, however, lose some tempo closer to the end, since when the things start to get real it is hard to tell what is going on. First-person underwater shots in murky water aren't that informative.Aside from some stupid decisions, most of the reactions were ok, but you can hardly call them motivated since we don't get any character substance. The main guy was motivated by youtube views, the lady just sort of stuck around. They barely share any story or character-related dialogue. The guy is just constantly narrating what is going on. I mean, I guess this works since he's doing a video blog. As for the female lead, I don't know, sometimes she's rightfully scared, sometimes she acts stupid, sometimes she's tough.I had some issues with the story, but most of them are minor, and in this type of film I can look the other way. I guess the rituals gave the family eternal life, and this also works for the house itself, maybe. Pierre brought divers as some fresh meat to the house, but what was his goal exactly? The door was Jesus-sealed, so I guess the previous divers didn't get to it and he assumed that these will? There's also a post-credit scene where he does it again, why? If the ghosts can brick up the windows why not do the same for the ending hole? The house didn't also have the look of a cultists' one, just a normal house with a weird kitchen. There are some tonal differences as well. The first scene feels like a basic found-footage introductory scene. The next one is ripped out of a hipster romantic comedy and finally - an underwater haunted house.Overall, The Deep House is watchable. The premise is very simple and even a little stupid, but it works in this context. An underwater haunted house. Ok.I appreciate the technical side of the film, although nobody can top the underwater scenes of Abyss (1989).It won't blow your mind, but you won't hate it either."
"https://www.imdb.com/title/tt11686490/reviews/?ref_=adv_li_tt","3"," Basically fails to entertains ","There's lots of part that doesn't make sense. I mean it's a movie right I understand. But the pic and some other stuff doesn't even dispose even under water for a very long time? The two main actors were annoying most of the time with their stupid lines & behavior. I heard the name Ben more often than in all my lifetime! She kept asking him stuff & he kept not answering! Nice couple! This movie was just terrible the girl gets scared easily over everything and screams or yells also no good scares and the backstory was a mess."
"https://www.imdb.com/title/tt11686490/reviews/?ref_=adv_li_tt","3"," Wow this movie was amazingly bad...Awful ","Interresting concept but its no banger, the tension goes to air the more aggresion you get with the stupidty that builds up. If have nothing to do and you are bored then you can waste 121 minutes of your life looking this, you can simply skip the beginning because there is no real story and meaning in this film. The backstory for the underwater house sounded more interesting they should've made a movie on that."
"https://www.imdb.com/title/tt11686490/reviews/?ref_=adv_li_tt","3"," A non-scary wanna-be horror movie, only for diving fans. ","I'm sorry, but having to watch a whole movie through a blurred green veil is not a treat! And that is exactly the case here: the whole movie is set under water, where we follow a couple who dives for fun at buildings that are for some reasons on the bottom of lakes. The outside of the lake where they go for is pictured radiantly blue and bathing in the sun, but once under water it's all dark and misty and very hard to follow. Okay, maybe very authentic, but for one and a half hour this gets rather annoying.Especially annoying, since in this supposed horror movie almost nothing happens, let alone something remotely horrific. There is only one tiny scare, when some drowned persons that they find in the sunken house suddenly open their eyes and turn out to be alive, but after that we just see these drowned zombies (who by the way look as normal and un-scary as anyone alive!), swim endlessly behind the fleeing main characters. Of course they get stuck in the house, of course their oxygen runs out, and the only clich that is avoided here is the proverbial last girl standing, because in the end no-one makes it alive. So if you weren't frustrated already, this will definitely do the trick!There is hardly any acting involved, or it's at least hard to judge, since both actors are packed and hidden in their diving-gear, and their dialogue consist mainly of continuously shouting the name of the other one. Well, that they do convincingly. So my final advice would be: stick to the sunny blue surface and stay away from this totally superfluous Deep House!"
"https://www.imdb.com/title/tt11686490/reviews/?ref_=adv_li_tt","8"," Never seen this before ","Underwater haunted house this idea was amazing and finally not a remake.Really like this movie. Its well made, some good scars the story is normal but just the fact that its underwater makes it more scary."
"https://www.imdb.com/title/tt11686490/reviews/?ref_=adv_li_tt","6"," Typical haunted house flick. But wait ","This one takes place underwater . After watching the trailer I thought it was going to be terrible. I liked the concept so I decided to give it a shot. Surprisingly it turned out to be a fairly decent film. Nothing special about it other then it taking place underwater. However! It flowed well and most importantly it kept my attention. I would definitely like to watch the making of this movie."
