"https://www.imdb.com/title/tt11686490/reviews/?ref_=adv_li_tt","7"," Claustrophobic and CREEPY!! Halloween list add-on ;D ","Really nice to see something a bit different from the done to death genre's used in horror for decades. If your scared of Deep and Dark water like me (cause it's full of MONSTERS!) lol Then you may-well enjoy this movie.Mick Jagger's son is one of the 2 main character's and he did a good job along with the gal that played his girlfriend. Can't imagine how hard this would be to film. That alone would have been a Nightmare for the film crew! :o It's Dark, Creepy, Claustrophobic feeling and Disturbing and I've always been fascinated by Man-Made Lakes that used towns and just flooded them and everything is still there... Under the Murky Water... and all the secret's of those towns buried there, just waiting for YOU! Ha hahahaha Worth a one time watch at least! ;D."
"https://www.imdb.com/title/tt11686490/reviews/?ref_=adv_li_tt","4"," Sunk ","The idea of a haunted house underwater was better than the execution. When video maker and girlfriend dive into the submerged house, they discover its (unsurprising) history and fight to get out."
"https://www.imdb.com/title/tt11686490/reviews/?ref_=adv_li_tt","7"," Good movie to watch in good sound effect ","RATED 7/10 Language: EnglishNice horror flick in underwater... It has real jump scare moments and decently paced screenplay... Recommended to watch in good sound effect.... One time watchable."
"https://www.imdb.com/title/tt11686490/reviews/?ref_=adv_li_tt","6"," Something different ","I have to give them props for trying something different. This is the first underwater horror movie I have ever seen, and given the small budget I think they did a good job. So congrats. Worth a watch imo.6/10."
"https://www.imdb.com/title/tt11686490/reviews/?ref_=adv_li_tt","5"," Should've been scarier from these two guys ","Idk I really like these directors but their last two movies have been underwhelming and under developed.. "The Deep House" follows a couple who investigates creepy locations for their youtube channel. Traditional enough. The girlfriend is almost giving an odd vibe from the start like she's hiding something, or is just really sick of the boyfriends youtube obsession. Even if it's the latter, the way she was standoffish and so talky with the stranger that led them to the deep house made it seem like a secret was going to be revealed at some point. However, as soon as rhe couple dives down underwater the entire surface level plot disappears and is never revisited. There could have been major drama, a war whirling about, forshadowed objects secretly placed for later explanations, and unexplained green eggs and ham on land and it STILL would have all been dropped the second the submerged underwater. The dude that brought them there's last scene was him sitting on a rock at the waters edge. Was he good?...bad?... These directors that I previously adored made these same mistakes is "Kandisha". There were unexplained things and dropped subplots through out that film too.I just say the music was really good in the first third especially then opening credits song. The opening credits were done really well. I was so interested in the first 30 minutes of the film. I couldn't wait to see how these directors deal with the underwater elements especially because I knew of this movie for a long timenbefore it's release. When they got down to the deep house there was a sense of uneasiness with a veterans touch. This is that feeling we got more from horror movies from 2012-2016. Since then people have been trying to be SO different and SO unique that this traditional unnervingness is lost within. It is ever present here, though. There was truly creepy nuances and clues in the deep house. The dead people chained below is a cool concept and pretty scary. This all worked imo until they return to the dead people and they are gone. This is where it became a more basic and traditional horror film for me. I call it horror because yes it is a horror movie in the sensenof the genre but there are no kills here untilnthe only two characters in the very end. The previous films by these directors have been chock full of violence and bloodshed, their first film even being an extreme horror movie that is unwatchable to most. They toned it down big time.The thrill of the underwater becomes mundane as the movie enters boring territory and between its shaky jumbled camera work while being chased and its lack of development in the second half of the film, it ends with a small puff of dust. Average film."
"https://www.imdb.com/title/tt11686490/reviews/?ref_=adv_li_tt","6"," The premise is genuinely unique, but it doesn't do enough good things with it. ","Okay, so I have to preface this by saying that I watched this based on the pedigree of the writer/directors without so much as glancing at the trailer. By the writers/directors of Inside, one of the greatest horror movies ever made?!? I couldn't download this movie fast enough!So the premise is that there is a Youtuber couple who want to take their channel to the next level by scuba diving to an intact house at the bottom of a lake. Okay, I've seen hundreds of horror movies in my time, but I have never seen or heard of one where the setting is submerged house, meters below the surface of the water. It was nice to be given something unique for a change, and it started off really promising....and then it fizzles into a wholehearted MEH of a movie that could have been so much more if they just pushed it further. First of all, the physics inside the house were all over the place. I mean, I get that they needed to allow the couple to freely traverse the place without constantly bumping into chairs and phones and stuff, but come on! We had certain objects just laying there, as if they weren't submerged at all, just sitting on desks like they were above water. The next scene, there'd be pianos and chairs floating all over the place. At least be consistent with your setting!Then it's the actual "horror" in this horror film. Jump scares annoy the living hell out of me, and this movie was just one jump scare after another. I mean, are these the same guys that made a movie about a nurse cutting a baby out a woman's stomach? What happened? When did they start making juvenile, tween horror films that rely on jump scares instead of being truly disturbing? I was hoping for a twisted plot about the ghosts of a deranged family trapped in a house after it became part of a dam. What I got was a lame story about child sacrifice, revenge of the town's people and not even a full exposition, just some half-hearted explanation that made me roll my eyes in a "we've seen this a hundred times" type of fashion.Man, I really wanted to like this movie, and it really did have everything going for it; the acting was good, the setup was strong, and the actual action was mostly clean and easy to see. But then the "ghosts" all looked like they were holding their breaths and it just ruined everything from that moment on.Waste potential from two dudes who could have done so much more, but I guess profit beats artistic integrity these days, doesn't it? What a shame.At least the ending was realistic and wasn't ruined by American horror movie standards."
"https://www.imdb.com/title/tt11686490/reviews/?ref_=adv_li_tt","2"," Plankton Poop! ","I was really looking forward to this.So much disappointment.Some of the most emotionless, non-human, illogical, acting and dialogue I've seen in quite a while. Topped off with absolutely no horror, no tension...and no jump scares.Boring, slow, unrealistic, annoying!"
"https://www.imdb.com/title/tt11686490/reviews/?ref_=adv_li_tt","7"," Creepy ","I guess this is more scary to people with a fear of dark water, or lakes. That combined with a haunted house... eek. Also not being able to get away fast enough in the water."
"https://www.imdb.com/title/tt11686490/reviews/?ref_=adv_li_tt","6"," average horror uplifted through cinematography ","What begins as a As Above So Below rip off descends into schlock nonsense by the end.But on that journey the viewer does get treated to some spectacular underwater camera work - and all around production. Some of the shots later in the film are so startling, it makes me wonder if filming was intentionally restrained during the first act to increase later impact. Probably not! But kinda felt that way.The story is super frustrating, predictable and disappointing. No meaningful rules are established, the horror is neither described nor satisfying in its mystery, and the ending? An attempt to get cute at the end just feels dumb. This movie could been saved by a good third act, and really (because of the loose nature of story telling) the third act could gone in many interesting directions.Feels a lot like I'm describing a 4/10 movie at best, but I'm not exaggerating - the underwater production and shots are just incredible. Some very haunting imagery is there to be had. The moment to moment interaction, pacing, throughout the film is also sound. That includes dialog, acting - location... Deep House does stuff right.I rarely go over a 5 for movies I feel struggle with story, but I had some fun with this one. 6 out of 10."
"https://www.imdb.com/title/tt11686490/reviews/?ref_=adv_li_tt","9"," So claustrophobic you'll feel like you're drowning while watching it ","THE DEEP HOUSE is an extremely unique horror movie with good acting, creepy visuals, and an atmosphere that smothers you beyond the end credits. The majority of the movie takes place underwater and is so claustrophobic that you'll feel like you're being drowned while viewing it. I haven't felt this suffocated since the first time I watched THE DESCENT - seriously. I thoroughly enjoyed this one and highly recommend it."
"https://www.imdb.com/title/tt11686490/reviews/?ref_=adv_li_tt","2"," Brilliant start and the... writers ran out of ideas. ","It is a huge swing and a miss. The whole concept from the start was just amazing as you wonder what is going on, what is with this house under the water, and what is the mystery.But then it just turned into a cliche pie of a generic overdone horror flick... well, except it is underwater.I wish I didn't waste my time on this."
"https://www.imdb.com/title/tt11686490/reviews/?ref_=adv_li_tt","1"," Ben Ben Ben ","Oh my lord. 75% of this movie is the woman screaming Ben Ben Ben Ben. Over and over and over. To the director of this movie, you made your point, she was looking for Ben. Was it really necessary for her to scream it 100 times during the movie. That alone brought the rating down a few but the ending and the whole movie being in the dark where you only see 25% of the screen and the rest is black and several other reasons. My recommendation skip this piece of garbage. You'll be more satisfied sorting your sock drawer then watching this movie."
"https://www.imdb.com/title/tt11692070/reviews/?ref_=adv_li_tt","4"," Good for kids ","After losing her parents, fourteen-year-old Annabel has moved in with her grandfather a fisherman, on a Caribbean Island where her best friend is a dolphin named Mitzy. However, her maternal grandparents don't see this as a suitable life for a young girl and come to take her away.We don't often watch family films here, but this is a cute story about finding the family that you want, not the one you are necessarily born into. Peter Woodward (who was in The Patriot) is really good in this as the grandfather. It's a nice film for young audiences who are animal lovers and may not have seen many coming of age movies.Mike Disa, who directed this, comes from the animation world, having directed films like Dante's Inferno and Dead Space - based on the video games - and kids movies like Space Dogs: Adventure to the Moon, Postman Pat: The Movie and Hoodwinked Too! There's a horror connection as well, as writer Shaked Berenson produced Turbokid, JeruZalem, Slaxx, Tales of Halloween and The Man Who Killed Hitler and Then the Bigfoot."
"https://www.imdb.com/title/tt11692070/reviews/?ref_=adv_li_tt","8"," Beatiful locations for a touching story about how love is a bond that can't be broken ","Dolphin Island is an interesting movie because of the dynamic between the two characters, Jonah (Peter Woodward) and Annabelle (Tyer Jade Nixon). I enjoy the relationship between the characters and the humanity added to the dolphin is a unique touch. It is interesting to watch Jonah and Annabelle interact with the dolphin. I really love seeing the dolphin perform human tasks and seemingly communicating with Annabelle. This shows how the director, Mike Disa, humanizes the dolphin. Dolphin Island makes me believe the characters enjoy spending time with each other and they truly love one another. The only problem I have with the movie is the title. Calling it Dolphin Island makes me think there's a bunch of dolphins in the movie and they are the focus of the movie. However, the movie is good enough for me to quickly get over that disappointment.The story is about a 14-year-old girl, Annabelle, whose parents die and who lives in the Bahamas with Jonah, her grandfather. Her best friend is a dolphin named Mitzy. Life is good until Annabelle's maternal grandparents (David Raizor and Annette Lovrien Duncan) show up with a lawyer and demand that Annabelle come to New York to live with them.At times Dolphin Island can be sad and emotional, especially when it comes to Annabelle and her great loss. The actors portray the emotion you would expect from a family that loses a loved one. Annabelle's character says and does some things that I see myself doing in the same situation, such as treating Mitzy like a person. When Mitzy sprays Jonah, Annabelle says it is because Mitzy is a good judge of humor. Also, Peter Woodward (as Jonah) really seems to have a good relationship with Annabelle. For example, when Jonah says he wants to show Annabelle what it is like to be happy, I really believe his character wants this. Dolphin Island shows us the relationship between some of the people on the island with Annabelle, Mitzy and Jonah. Seeing those relationships makes us see why Annabelle is so happy on the island and how this helps her cope with her parents' death. The story offers a brilliant take on what makes a family a true family - sometimes family is by blood, sometimes by friendships, and sometimes with animals. Dolphin Island presents some unpredictable plot twists you don't expect along with strong character development.The message of this movie is that family will always be there for you and that love conquers all, even when things are at their worst. Along with that strong message, just like the title suggests, Dolphin Island teaches viewers a little about dolphins and how lovable and smart they really are.I give Dolphin Island 4 out of 5 stars and recommend it for ages 5 to 18. Grownups will enjoy it as well. Reviewed by Ayden P., KIDS FIRST!"
"https://www.imdb.com/title/tt11692070/reviews/?ref_=adv_li_tt"," Was this review helpful? Sign in to vote. "," heartfelt, fun movie ","Dolphin Island is a touching, heartfelt, beautiful movie. Fun entertainment for the whole family. Highly recommended!"
"https://www.imdb.com/title/tt11692070/reviews/?ref_=adv_li_tt","10"," Amazing ","An absolute work of art. Never have I ever seen a movie this amazing. The story, the acting. the script, the music, cinematography, everything is perfect. 100% lack of the name Liam. perfect work of art. must-see"
"https://www.imdb.com/title/tt11692070/reviews/?ref_=adv_li_tt","10"," It made me giggle, cry, grimace, and sigh, but ultimately left me beaming. ","Dolphin Island is an emotional, inspiring, feel-good movie! It demonstrates the significance of communal friendships and familial bonds. I enjoyed the themes of good vs evil and the power of love, and how it offers a true bonding experience.This is such a positive and satisfying film. I quickly connected to Jonah Coleridge and his teen granddaughter, Annabel. Their relationship is exceptionally sweet, and though their Dolphin Island houseboat is an unconventional home, it is filled with tenderness, acceptance, and love. The island neighbors are fun and diverse, and Annabel's best friend, a lovable dolphin named Mitzi, might be the dearest Island member of all.There are so many great characters/actors in this movie. My favorites are:Jonah Coleridge, played by Peter Woodward (THE PATRIOT) Annabel Coleridge, played by Tyler Jade Nixon (DOLPHIN KICK) Mateo, Annabel's sly, lovable friend, played by Aaron Burrows Mr. Carbunkle, the easy-to-dislike lawyer played by Bob Bledsoe (PARKS AND RECREATION)I enjoyed every aspect of this tale. It made me giggle, cry, grimace, and sigh, but ultimately left me beaming. Dolphin Island a clean, meaningful, and soul-stirring film suitable for the entire family.Disclosure: Many thanks to Entertainment Squad for providing this product/product information for review. Opinions are 100% my own and NOT influenced by monetary compensation. I did receive a sample of the product in exchange for this review and post."
"https://www.imdb.com/title/tt11692070/reviews/?ref_=adv_li_tt","8"," KInda like the 1960's Flipper TV Series ","Without giving away too much of the story, I can tell you it has the same overtones as the 1960's TV series, FLIPPER, but updated to modern times. If you are old enough to remember this fun, family- oriented TV series, you know it involved an extraordinarily intelligent dolphin that was "best friends" with two main teenage characters, Sandy and Bud, and he often helped rescue one (or both) from a dangerous situation surrounding the sea. The TV series was entertaining and full of family values. It is the same with DOLPHIN ISLAND. While it may not be the best film I have ever seen, it was good, and I would recommend it for families and/or youth groups. On the website, you can even download a FREE 5-Session DISCUSSION GUIDE to help with group discussions, covering the topics of courage, faith, and forgiveness.Many thanks to Entertainment Squad for providing a link for this movie review. Opinions are 100% my own and NOT influenced by monetary compensation."
"https://www.imdb.com/title/tt11692070/reviews/?ref_=adv_li_tt","5"," Very bad dialogue writing and direction ","It's a feel good movie with obviou storyline.That's all right.But why this atrocious dialogues.There are at least 30 mins of unnecessary dialogue.Its not a animation movie for kids!! I cringed every time they try to spoonfeed words and sometimes those words doesn't match action and emotion of characters. They could have shown the island more and do some character development."
"https://www.imdb.com/title/tt11692070/reviews/?ref_=adv_li_tt","7"," Cute and Clean family film! ","One of the things I miss from my time in Christian Retail was helping to review nearly every film that we sold for content. In the Christian film industry, there are times where you get GREAT films, and other times you get films that are well meaning, but due to poor writing, acting, etc., they miss the mark.The kids and I recently given the link to watch this film, Dolphin Island, and to review. The concept of the movie is simple. A Young girl has experienced the loss of both parents and is living with her Grandfather in a houseboat in a fishing community. The rich Grandparents who have had nothing to do with her for 10 years now want to take full custody and will use any means necessary to do so.First let me say, it is a well-suited film for young children, although the topic can be a bit intense and there is a scene where the girl runs away, and a boat explodes leaving her unconscious in the water. Depending on your child that might be a bit intense. If you are looking for a family movie night without language, violence, and you've caught up on all other films. Then this is the film for you.The scenery is beautiful, and the use of live animals is a plus in this film. Especially on a snowy northeast Ohio day, it will make you ready for a vacation to Sunny Coasts.Some of the acting makes this a movie that my teenage self would have made fun of my parents for watching. Yet it is very enjoyable and fun to watch. Disclosure: Many thanks to Entertainment Squad for providing this product/product information for review. Opinions are 100% my own and NOT influenced by monetary compensation. I did receive a sample of the product in exchange for this review and post.#DolphinIslandMIN #MomentumInfluencerNetwork"
"https://www.imdb.com/title/tt11692070/reviews/?ref_=adv_li_tt","10"," Hope at home ","After a lot of time at home, we were thankful for a family-friendly movie I got to screen from the comfort of our couch. My husband, mother-in-law, and I may have liked it more than the kids, but we also were glad for some clean entertainment to share with the youngsters in the house."Dolphin Island" is a heartwarming feature film about 14-year-old Annabel who lives with her fisherman grandfather on an island paradise. They operate a nonprofit marine research and conservation center. She is surrounded by an extended family of loving but quirky neighbors and her best friend, a dolphin named Mitzy. Everything changes when her maternal grandparents arrive with a shifty lawyer to bring her back to New York. Annabel and her friends navigate these circumstances to prove that love conquers all.My kids all reacted like anyone who knows them would expect: Rachel, who is 5, talked about how much she likes dolphins and asked about going to the beach. The 11-year-old Ben liked the action that came with the pirate-like barrister, which of course we had to define as an attorney for him. Cate, the resident teenager, wasn't so sure about an inspirational film, but she periodically made comments about the main character."
"https://www.imdb.com/title/tt11692070/reviews/?ref_=adv_li_tt","8"," Recommended for the whole family ","Dolphin Island is a fun, family-friendly film. The photography was quite good and the location was lovely.Anna's story was touching - orphaned at five years old. And her loving grandfather, Jonah, gave up his career as a history professor at Cambridge to take over her care and run the marine institute her parents had founded. Jonah was quite realistic in that he got angry when provoked and made a couple of poor choices that added conflict to the story. The friendship between Anna and Mitzy, the dolphin, was sweet! I liked watching them swim and play together.I really appreciated that there was no foul language and that even though they were in a tropical location, there wasn't an overabundance of skin on display. Ana wore a one-piece swimsuit when she was in the water and dressed tastefully and modestly when on land.While lighthearted for the most part, a conflict brought a somber element that helped balance the rest.My husband and I both felt that the acting was, at times, a little over the top. Especially at the beginning. Some situations were simply implausible - and not just because the film targeted a younger audience.Overall, I recommend this for anyone looking for a wholesome film for the whole family to enjoy.Many thanks to Collide Distribution for providing this product/product information for review. Opinions are 100% my own and NOT influenced by monetary compensation. I did receive a sample of the product in exchange for this review and post."
"https://www.imdb.com/title/tt11692070/reviews/?ref_=adv_li_tt","9"," Great for Family Night at the Movies ","Perfect movie to get your mind off of your troubles. True it is temporary but still it is better than nothing. Last year was crazy and we all can use a break even if it is for an hour and a half."Dolphin Island" is about a 14 year old who lives with her grandfather who is a fisherman. Challenges occur when her grandmother on her mom's side wants to take her. Guess who becomes her friend? Mitzy, a dolphin.Full of family values that you will want to share. Totally would suggest this movie be in your watch list.#dolphinislandmin #MomentumInfluencerNetwork"
"https://www.imdb.com/title/tt11694776/reviews/?ref_=adv_li_tt","2"," Boring ","Although the premise may seem interesting, it gets slow and boring very quickly, the whole first hour of the movie tells you absolutely nothing, the script is disgusting, too many unnecessary scenes, it does not have a good plot, the plot is poor thing, what happens does not make much sense, the performances are not bad but not very good, the dialogues are terrible, I could not empathize with the main character since he makes the most stupid decisions, the only remarkable thing is the photography that emphasizes the nature that surrounds the characters and the production design is good too. The script makes it unbearable to endure more than an hour and a half watching the movie, definitely a waste of time."
"https://www.imdb.com/title/tt11698630/reviews/?ref_=adv_li_tt","9"," Crazy in love ","Different than Beyonce meant for sure. But still crazy as can be. Now seeing the main female character, it is not really tough to make her - to decipher her ... issues? That's one way to describe her - but it also makes her fun and exciting. Of course the question is, with all the highs, there are obviously also a lot of lows along the way.What really makes this movie though is not the crazy couple itself. Or not just to be fair - because one of the most emotional moments (or a couple of them to be truthful) comes from a side character and his daughter. Even without having children of my own - this really strikes home! I do believe that viewers will be touched by that scene .. really putting the heart into all the craziness going on.A movie that is as heartfelt as it is funny ..."
