"https://www.imdb.com/title/tt11219254/reviews/?ref_=adv_li_tt","9"," Artistic Youth's Love beat by Reality ","Even a week after watching the movie We Made a Beautiful Bouquet, I still couldn't get rid of the sadness it gave to me. So right here, I start to write my thoughts down in order to commemorate it, the first love movie which touched me so deeply.I've search this movie on IMDB, surprisingly found that there are only 591 comments about it, with average stars 7.1, compared to 79826 comments with average stars 8.7 on Chinese film review website Douban, which made me profoundly aware of the cultural difference between the east and the west.As it says, the whole movie is talking about love between an artistic youth couple beat by cruel reality."Those two, they don't like music." "Pardon?" "The music is not monophonic, but bi-vocal. With one wired headphone, the left-side sound and the other side is different. It's another song when you listen to it with only one side of headphone." "The song mixers must be pissed off and have thrown out the midnight snack." Kinu and Wataru explained to their respective partners that two men share a same wired headphone is definitely a dishonor to music, not knowing that just a table away, standing a similar soul.When they met again because of missing the last train, they and another couple of man and woman stayed in a bar, waited for the next day coming.Mamoru Oshii just sit not far away and the man started to talk about movie."People says that I'm a movie buff." The woman asks, "what movies do you watch?" "The Shawshank Redemption." "I heard about it." "It's a super touching movie." "Really? I watched Kiki's Delivery Service last year." "The live-action version?" "Yes." Wataru, wearing a constipated face, thought in his head."why the real master is in front of them, they are still talking about the live-action version of Kiki's Delivery Service. The are so many live-action versions in just because of you people?" Kinu just sit aside without saying anything.Then after the four said goodbyes, Kinu caught Wataru, with a smiling face, and asked."It was OshiiMamoru, right?" "You know him?" "Whether you like him or not, you should know him at least." "Sure, he is the greatest." "You are right." Kinu nodded.Then they came to a izakaya (Japanese Pub), and started a real conversation."I'm Kinu Hachiya. My favorite saying is 'free refill for noodles'." "I'm Wataru Mizuno and my favorite saying is 'stuff like spade'." They exchanged they reading notes, talked about Hironagashu and Homura's poems, their favorite writers and bands, their common habits of using movie stubs as bookmarks, ended up with finding that they both bought the tickets of guinea-pig exhibition and missed it.I recalled the so-called Bible for artistic youth, Before Sunrise trilogy, where Jesse and Celine also started their conversation with the books they read when met on train. So if you want to step in a artistic youth's world, just go to read the books she reads, the movies she watches.And when she stands in front of your house bookshelf, says like Kinu in the movie, "It's exactly the same version of my bookshelf", it's time for you two to become one.After a couple of times of missing the last train, Wataru expressed his feelings to Kinu.And I thought that's it, a simple lovely Japanese movie.But it's not.Wataru and Kinu set foot in the real society after graduation.Kinu cried under a high-pressure interview, and Wataru asked."Who is that interviewer?" "A great senior." "He might be great, but he must have no feelings after reading Natsuko Imamura's Picnic." "It doesn't make sense to employment." They started to live together. Wataru got a job at business department, went back home 8 p.m. Everyday. Colleague told him it will be better after 5 year's fighting.Work was getting more and more burdensome. Kinu found that Wataru hasn't touch his once loved paintbrush, could put off the stage play they scheduled, wear a listless face when watching movies, started reading success books instead of poems.In a fierce quarrel, Wataru mentioned a old customer told him to die and spat on him."He is so weird." Kinu said."He is a great man." "He might be great, but he must be emotionless after reading Natsuko Imamura's Picnic." "Maybe I am too now." I shed my tears for the first time when I watched here, but not because of love.Till here, about 4/3 of the movie has passed, and I don't want to keep writing. The rest is worth watching and feeling by yourself.I thought it will be a beautiful romanticism, but eventually I realize the low-plot life is the cruelest realism.Let me quote a heat comment from Douban here: The most romantic love an artistic youth can imagine is that, running in the rainy night when first met, having 100% similar artistic taste, kissing in front of a red light after confession, making love for a whole week in a rent room, living together in a flat with a huge balcony, picking up a cat at New Year's worship, and then break up peacefully after a long time consuming, recall past times at the once visited place, still think of each other when it's rainy outside. It's like the fantasy of people who yearn for love but don't believe it.There are a lot of details worth sharing. If you have time, go and watch it, it will be your best love movie this year."
"https://www.imdb.com/title/tt11222994/reviews/?ref_=adv_li_tt","3"," a neurotic mayhem... ","On the borderlines of sanity, a film about a half jobless make up artist, that does his best to survive at the local theater scenes, stumbles into a killing crime, gets caught by the assassins, breaks away, and dives into a nightmarish downspiral of a hideway run of fright and horror and in the end a kind of graphic revenge...its an amateurs workshop movie, where everything is on a basic level, and the sack of gold quite empty, there are sound issues en masse', light settings not good enough for a dark environment horror flick, low standard filmography, and editing, the score is a one man show that sound horrific and well suited for the chime of the genre. the story line are very clockwork orange like, and the advertized comedy sits deep in there, maybe fun for some...the grumpy old man gives a weak three for this a-z errors of filmaking, its less than a time filler and will not get my recommendments, its too weird and nothingless."
"https://www.imdb.com/title/tt11222994/reviews/?ref_=adv_li_tt","8"," Blurring the Lines - Comedy Thriller ","This cool cerebral and complex film has some laughs and unique qualities. If you have seen Ant DeGennaro's other work like Sisterhood of Death or Cassavettes, you will see some of his welcome art style here.He tends to mix very candid humor in with some horrific topics which breaks the 4th wall, but keeps you engaged nonetheless. I would say this film is an evolved version of his earlier work and really hammers home his abilities to deliver something uniquely interesting."
"https://www.imdb.com/title/tt11222994/reviews/?ref_=adv_li_tt","8"," A New Effort in a New Direction ","IMTHEM is a film that requires an audience that understands that indie is NOT and never will BE the Hollywood Machine. If you're familiar with the early works of directors such as Cassavettes you understand that one film is only an indicator of where a director is going. DeGennaro is well on his path to greatness. Does the the film have challenges? Yep and that is not in question. The heart the film, the humor of the film and the performances give a nod to directors who have taken challenges and finished the job. Perhaps not to everyone's likings but I recently saw WonderWoman and with hundreds of millions of dollars all of the creativity that Hollywood could muster, the film still got panned. So, when a new voice rises, I tend to give them the benefit of the doubt. Nice effort and I'm sure it will find it's audience."
"https://www.imdb.com/title/tt11222994/reviews/?ref_=adv_li_tt","7"," We're all Them? ","David, a makeup artist, stumbles upon a major crime scene and slips down a nightmarish paranoid film noir rabbit hole. IMThem adeptly combines suspense with comedy and features fine performances most notably lead Clay Ballard and supporter Larry Laverty What cheapens this production is the occasional appearance of dime store gore. Nonetheless I'm watching it more than once!"
"https://www.imdb.com/title/tt11231280/reviews/?ref_=adv_li_tt","4"," Just couldnt get into it ","I didnt have any expectations, wanted to like it, but just didn't. Was hoping for an amusing for both parents and children adventure animation like puss n boot, how to train your dragon, secret life of pets, etc. But this movie seemed to demo towards the toddler to 5y.o. Audience. Not sure anybody over the age of 5 would like this movie too much."
"https://www.imdb.com/title/tt11231280/reviews/?ref_=adv_li_tt","6"," Adventurous and Amusing ","The plot is average but you will love the characters involved in the film.The animation is amazing and dialogues are well cornered.You will enjoy the film with family and kids.The film gives you a heartwarming experience."
"https://www.imdb.com/title/tt11231280/reviews/?ref_=adv_li_tt","8"," Heartwarming movie ","I thought that this would be terrible like BOSS BABY 2, but it is very charming with a sweet story to go with it. A very good family film. Entertaining, adventurous and funny."
"https://www.imdb.com/title/tt11231280/reviews/?ref_=adv_li_tt","8"," Very nice film worth watching ","Nice film for younger kids with a nice story and moral within the story, animation very nice kids enjoyed it kept the kids glued plus as an adult I enjoyed it. Well worth watching the animation is beautiful. The characters are well written."
"https://www.imdb.com/title/tt11231280/reviews/?ref_=adv_li_tt","9"," Fantastic family movie ","Truly enjoyed the film. Really nice animation, great cast and lots of funny moments with the cat."
"https://www.imdb.com/title/tt11235772/reviews/?ref_=adv_li_tt"," Pretty good movie with a different take on observing others. ","Many newer IMDb users don't have a clue how to meaningfully review a movie. THIS IS NOT A "1" or "2" MOVIE. So especially ignore the reviews that say this is a trash movie and not worth the time to see it. While it borrows only slightly from "Rear Window" it is a unique story about observing others and the ethics involved. It can be considered a modern fable, not all of it has to be realistic.Set and filmed in Montreal it starts with a young dating couple moving in together. They get a downtown apartment in a medium-rise building, and a similar apartment building is right across the street. It seems few residents pull curtains all the way shut so that makes for some interesting visuals. The story builds nicely towards several interesting twists during the second half. And I won't even mention the sexy soft porn scenes from about 1:21 to 1:25 into the movie, showcasing Ms Sweeney's ample assets.If you like this sort of movie, there are several new things and a bit of wicked revenge, then followed by more wicked revenge. The actors are attractive. The cinematography is done very interestingly, the sound is excellent. If a movie does nothing more than make you think "What would I do in a similar situation?" then it has some value. And this one does.There is a Pippa line, my favorite, about 20 minutes from the end, "Tell me this one thing and you'll never see me again."The most common votes so far are "6" and "7" which is about right for this movie. The production values are good, the acting is fine, the story has some interesting elements. Filmed in Canada.(As an aside Sydney Sweeney fans should look up teenage Irish busker Allie Sherlock, their faces are spitting images of each other.)"
"https://www.imdb.com/title/tt11235772/reviews/?ref_=adv_li_tt","3"," Listless and absurd ","A young couple, Pippa and Thomas, discover that their neighbours are not at all privacy-conscious, allowing them to see all that happens in their apartment. They start spying on them, initially simply out of voyeurism. However, Pippa then starts meddling in the neighbours' lives, with dire consequences.A film that is billed as a steamy thriller but for the most part it is pretty listless and tame, meandering aimlessly about. This results in the film taking about 20-30 minutes longer than it should.When it finally does find a direction it is absurd and implausible. It seems so tangential and ridiculous that It feels like the writer generated it randomly.Not much to recommend (though I didn't mind Sydney Sweeney...).So much for "if you can't make a good movie, make a short movie"."
"https://www.imdb.com/title/tt11235772/reviews/?ref_=adv_li_tt","6"," Not a disaster ","A young couple move into an apartment, and the girl becomes obsessive about the sexual behaviour of the couple in the apartment across the way. No-one in this film has curtains or blinds.I was expecting this movie to be a typical skinflick (and it does have a steamy scene featuring the pneumatic Ms Sweeney: this girl has a great future in front of her, and when I say "great future", that's not what I mean at all, know what I mean?).But, in fact, there is a tolerable plot, some interesting ethical issues, a couple of decent twists, some lovely photography and well-crafted sound design, so there is worthwhile stuff to watch.Unfortunately, the male protagonist is annoying and the first half the film is very slow, so there's that, too. That brought it down from 7 to 6 stars for me."
"https://www.imdb.com/title/tt11235772/reviews/?ref_=adv_li_tt","7"," Refreshingly explicit thriller, ruined by its own indulgence ","STAR RATING: ***** Saturday Night **** Friday Night *** Friday Morning ** Sunday Night * Monday MorningPippa (Sydney Sweeney) and Thomas (Justice Smith) are a young couple who live in an apartment in New York City. From the view of their window, they are able to stare across the street into the apartment of fellow young couple Seb (Ben Hardy) and Julia (Natasha Bordizzo) and the open eroticism they enjoy with each other. After a while, what they are able to see crosses boundaries, and when Pippa strikes a friendship with Julia through her work as an optician, it sets in motion a devastating chain of events with deadly consequences.We live in a time where privacy has become largely redundant. If we don't have apps spying on us through our phones, tracking our movements and relaying it to God knows who, or companies selling our data to whoever we inadvertently allow them, to reality TV shows where we spy in on the private affairs of people we don't know for entertainment they're in on, the age where everything felt secure feels long gone. And so, there is at least a refreshing honesty in what they both know they're doing to the central protagonists of director Michael Mohen's dark erotic thriller, an at least pleasingly adult and unrestrained piece with a deeper undertone.Disasterously, it fails initially right at the beginning, introducing us to two undercooked, rather unengaging lead characters, who fail to really draw us in until they start their unethical business. This will write it off for some, but for those who stick around, it does develop in to a more dark and compelling piece, with lead star Sweeney displaying a skittish vulnerability as the girl with a dark secret, while part time East Ender Hardy has a strong presence as the domineering third party player, building up to a shocking conclusion with a dark twist, which gives it the feel of an old Tales of the Unexpected episode, but for some reason it decides to prattle on for another twenty or so minutes, completely ruining what could have been a great ending with a ridiculous turn of events.If it had had the good sense to end when it should have, it could have worked as a dark morality tale, but spoilt by its own indulgence, it leaves a nonsensical lasting impression, despite everything it got right, not least a drowned out new version of Billy Idol's 1983 classic Eyes Without a Face playing over the beginning and end credits. ***"
"https://www.imdb.com/title/tt11235772/reviews/?ref_=adv_li_tt","8"," its a fable... ","About happiness, grief, exploitation, revenge, avenge, photographic arts, sex, romance and fantasy, and as if it werent enough death leaves them blind, forever.Its a fantastic erotic drama thriller about voyerism within the glassy environment of the urban interface, and if youre not tantalized to drop a glance into your neighbours realms after watching this movie then youre a robot.Story and plot has resemblances to many films made over the past 50 years, and has the impertinent sexual glow that only a few might lit into a fire. The 50 shades of... series lingers in my mind,but i think this film will give the audience a better and more rewarding experience, and may in the end have extinguished the hormone rush of sexuality.I will put this on for my wife to see... alone...cause you never know the fallout of physical excercise a grumpy old man will have to endure afterwards. So take a deep dive into some of the finest filmographical fables made in the last decade. A recommend."
"https://www.imdb.com/title/tt11235772/reviews/?ref_=adv_li_tt","6"," Overall, I'm going to lean towards liking this flick ","I'm a little indifferent about this film.I watch the movie because Sydney Sweeney and Justice Smith were in it. Two actors that I come to enjoy and they were really good in it together.The story was really good too. If the bottom-line plot is that vengeance is an artform, then this movie has an ending that's almost a masterpiece.However, the story could have been handled better. The movie was a little too over reaching with the trivia (like the fact that one of the Voyeurs is an eye doctor). Things I feel that should have come off as subtle seem to be slapping me in the face whenever I turn around.The actors were pretty good at keeping us in the moment but not good enough for me not to see what was coming next in this predicable erotic thriller.As an erotic thriller however its top notch and it had its melodramatic moments that hit in a cool way."
"https://www.imdb.com/title/tt11235772/reviews/?ref_=adv_li_tt","9"," A hidden gem ","Early on in 'The Voyeurs' I thought we were in for the typical 'Rare Window' storyline we have seen dozens of times before. How wrong I was. This film is very different to that, and has so much more going on. This is one of those rare hidden gems where you see an IMDb rating of only 5.8/10 and could easily discard it, but if you do give it a chance you are so glad you did. I had a great time with this movie.The movie is hyper-sexual. Early on it implies that it is going to be quite modest, but this is very much misleading, and from there the film becomes very erotic for almost the duration. It feels very much like 'Basic Instinct' where there is a genuinely interesting story taking place and the eroticism is just a part of the ingredients.The film is a little longer than average for this type of movie, falling just short of two hours. I found myself so interested and invested in the story that the extra time didn't bother me at all, and instead allowed the movie to move at a more natural pace.The final act of this movie is bonkers. It throws everything it has at the kitchen wall, and most of it sticks. The twists and turns are authentically shocking and really caught me off guard. I can't recommend this film highly enough. Please see it. 9/10."
"https://www.imdb.com/title/tt11235772/reviews/?ref_=adv_li_tt","6"," Silly tawdry erotic thriller with aspirations at social commentary it never reaches ","Not only is "The Voyeurs" the kind of movie Steven Soderbergh makes, I also wish that he had made it. Michael Haneke, too. These auteurs would have found a style befitting of the material that would have made it seem plausible, that would have kept us engrossed, and that, hopefully, would not have required the ridiculous, jarring twists and turns that the movie ends on.The young couple move into an apartment in Montreal with windows that look directly into an apartment across the street. The very first time they look, they watch the couple in that apartment have sex. They continue to watch, get turned on, and even go so far as planting a listening device.The climactic twist isn't entirely predictable. I wasn't surprised. But still, Soderbergh or Haneke could have put more of a point on it. Here it was a bit "meh", as my generation likes to say.I really think that the twists and turns that come after were put in as an afterthought when the director realised nobody was going to buy what he had sold up to that point. It almost feels like a consolation prize, as though he's saying, "I agree that sucked because I don't have the skill to do it the way Haneke would have... oh well, here's some extra tawdry garbage."He should have just made an erotic thriller. This is more like "Sliver" than "Benny's Video" or even "The Girlfriend Experience". And an erotic thriller would have been more fun. The attempts at seriousness or social commentary come to nothing, and in the final act, are totally abandoned."
"https://www.imdb.com/title/tt11235772/reviews/?ref_=adv_li_tt","6"," Even though I pity the main character, but this film is really engaging to watch! Well done! ","This film start with a bunch of people walking at the street, and a woman closing the curtain in the fitting room scene! As turnout, this film is about a voyeur "Pippa" need to take revenge on her neighbors(Seb, and Julia) who causing the death of her boyfriend(Thomas)! Entire film full of adult fantasy scene! Make the film quite watchable! Especially the main character scene! At the end, Seb, and Julia blinded by Pippa! That's it! A quite entertain film!"
"https://www.imdb.com/title/tt11235772/reviews/?ref_=adv_li_tt","6"," PRETTY DECENT. ","For much of the 2 hours this retro "erotic" thriller moves at a snails pace, then everything speeds up for the denouement, at which stage the plot becomes absurd. It has a few good moments, but overall lacks genuine tension, a plausible plot and the viewer is left with a "so what" feeling."
"https://www.imdb.com/title/tt11235772/reviews/?ref_=adv_li_tt","7"," Got You To Look ! ","Don't lie to yourself. 95% of the people who want to watch this are here to see Sydney Sweeney's assets and nothing else. For those fans, you got what you paid for. Her eye candy alone makes this movie deserving of an audience. Now, for those who decided to watch this movie from start to end without fast forwarding to just the scenes with Sydney Sweeney showcasing her goods, you will be happy to find a movie with an actual plot. For all you Haters with high expectations, I want to remind you all that this movie is not Gone with the Wind. Therefore, those with low expectations will be blown away at this movie's high production value, decent acting, and interesting plot with a good ending. Those who hate this movie need to get their eyes checked for multiple reasons. The Voyeurs is exactly what it sets out to be. If you are looking for anything else, you came to the wrong movie. Worth the watch and even a few rewinds."
